{
  "schema_version": 1,
  "trace_id": "mod-m000-m000-player-obstacle-route-v1",
  "runtime": "mod",
  "content_profile": "repository-mod-12-level-20260729",
  "level": {"id":"m000","selector_level":1,"engine_mission":1},
  "scenario": {"id":"m000-player-obstacle-route-v1","coordinate_space":"legacy-world-pixels","description":"Window-local selection and movement observation; no global cursor or focus API; cells 9,7 -> 1,1."},
  "metadata": {"producer":"ModRegressionProbe","input_isolation":"window-message-to-process-local-DirectInput"},
  "checkpoints": [
    {
      "id":"gameplay_ready","sequence":0,"elapsed_ms":0,
      "camera":{"position":[0,0],"viewport":[1024,708],"zoom":[1,1]},
      "world":{"size":[4960,2240],"tracked_actor_count":1,"source_entity_count":1630,"runtime_object_count":127},
      "actors": [
        {"actor_id":"scene:1436","role":"player","scene_index":1436,"database_entry_id":924,"display_name":"强子","faction_id":3,"position":[241,51],"target_position":[241,51],"facing_direction":5,"alive":true,"hit_points":{"current":8,"maximum":8},"native":{"goal_kind":0,"command_variant":0,"command_pending":0,"movement_active":0,"movement_path_state":0,"movement_mode":0,"resolved_goal_x":0,"resolved_goal_y":0,"path_override_active":0,"runtime_index":18,"runtime_type":1,"target_status":0,"selected_for_command":0,"search_or_return_active":0,"search_delay_limit":77,"search_delay_counter":0,"contact_state":0,"target_lost":1,"reaction_state":0,"current_hit_points":8,"default_attack_type":4,"interest_runtime_index":-1,"interest_scene_index":-1,"target_runtime_index":-1,"target_scene_index":-1}}
      ],
      "mission":{"id":"m000","status":"active"},
      "tags":{"source":"stable-mod-read-only-process-snapshot"}
    },
    {
      "id":"player_selected","sequence":1,"elapsed_ms":2546,
      "camera":{"position":[0,0],"viewport":[1024,708],"zoom":[1,1]},
      "world":{"size":[4960,2240],"tracked_actor_count":1,"source_entity_count":1630,"runtime_object_count":127},
      "actors": [
        {"actor_id":"scene:1436","role":"player","scene_index":1436,"database_entry_id":924,"display_name":"强子","faction_id":3,"position":[241,51],"target_position":[241,51],"facing_direction":5,"alive":true,"hit_points":{"current":8,"maximum":8},"native":{"goal_kind":0,"command_variant":0,"command_pending":0,"movement_active":0,"movement_path_state":0,"movement_mode":0,"resolved_goal_x":0,"resolved_goal_y":0,"path_override_active":0,"runtime_index":18,"runtime_type":1,"target_status":0,"selected_for_command":0,"search_or_return_active":0,"search_delay_limit":77,"search_delay_counter":0,"contact_state":0,"target_lost":1,"reaction_state":0,"current_hit_points":8,"default_attack_type":4,"interest_runtime_index":-1,"interest_scene_index":-1,"target_runtime_index":-1,"target_scene_index":-1}}
      ],
      "mission":{"id":"m000","status":"active"},
      "tags":{"source":"stable-mod-read-only-process-snapshot"}
    },
    {
      "id":"move_outbound_commanded","sequence":2,"elapsed_ms":2856,
      "camera":{"position":[0,0],"viewport":[1024,708],"zoom":[1,1]},
      "world":{"size":[4960,2240],"tracked_actor_count":1,"source_entity_count":1630,"runtime_object_count":127},
      "actors": [
        {"actor_id":"scene:1436","role":"player","scene_index":1436,"database_entry_id":924,"display_name":"强子","faction_id":3,"position":[240,72],"target_position":[304,120],"facing_direction":5,"alive":true,"hit_points":{"current":8,"maximum":8},"native":{"goal_kind":1,"command_variant":1,"command_pending":0,"movement_active":0,"movement_path_state":2,"movement_mode":2,"resolved_goal_x":304,"resolved_goal_y":120,"path_override_active":0,"runtime_index":18,"runtime_type":1,"target_status":0,"selected_for_command":0,"search_or_return_active":0,"search_delay_limit":77,"search_delay_counter":0,"contact_state":0,"target_lost":1,"reaction_state":0,"current_hit_points":8,"default_attack_type":4,"interest_runtime_index":-1,"interest_scene_index":-1,"target_runtime_index":-1,"target_scene_index":-1}}
      ],
      "mission":{"id":"m000","status":"active"},
      "tags":{"source":"stable-mod-read-only-process-snapshot"}
    },
    {
      "id":"move_outbound_observed","sequence":3,"elapsed_ms":3634,
      "camera":{"position":[0,0],"viewport":[1024,708],"zoom":[1,1]},
      "world":{"size":[4960,2240],"tracked_actor_count":1,"source_entity_count":1630,"runtime_object_count":127},
      "actors": [
        {"actor_id":"scene:1436","role":"player","scene_index":1436,"database_entry_id":924,"display_name":"强子","faction_id":3,"position":[304,120],"target_position":[304,120],"facing_direction":2,"alive":true,"hit_points":{"current":8,"maximum":8},"native":{"goal_kind":1,"command_variant":1,"command_pending":0,"movement_active":0,"movement_path_state":0,"movement_mode":0,"resolved_goal_x":304,"resolved_goal_y":120,"path_override_active":0,"runtime_index":18,"runtime_type":1,"target_status":0,"selected_for_command":0,"search_or_return_active":0,"search_delay_limit":77,"search_delay_counter":0,"contact_state":0,"target_lost":1,"reaction_state":0,"current_hit_points":8,"default_attack_type":4,"interest_runtime_index":-1,"interest_scene_index":-1,"target_runtime_index":-1,"target_scene_index":-1}}
      ],
      "mission":{"id":"m000","status":"active"},
      "tags":{"source":"stable-mod-read-only-process-snapshot","observed_positions":[[240,72],[240,84],[234,91],[222,97],[208,104],[208,113],[208,120],[226,129],[238,135],[252,136],[270,136],[284,130],[302,121],[304,120]]}
    },
    {
      "id":"move_return_commanded","sequence":4,"elapsed_ms":3959,
      "camera":{"position":[0,0],"viewport":[1024,708],"zoom":[1,1]},
      "world":{"size":[4960,2240],"tracked_actor_count":1,"source_entity_count":1630,"runtime_object_count":127},
      "actors": [
        {"actor_id":"scene:1436","role":"player","scene_index":1436,"database_entry_id":924,"display_name":"强子","faction_id":3,"position":[260,136],"target_position":[48,24],"facing_direction":7,"alive":true,"hit_points":{"current":8,"maximum":8},"native":{"goal_kind":1,"command_variant":1,"command_pending":0,"movement_active":0,"movement_path_state":2,"movement_mode":2,"resolved_goal_x":48,"resolved_goal_y":24,"path_override_active":0,"runtime_index":18,"runtime_type":1,"target_status":0,"selected_for_command":0,"search_or_return_active":0,"search_delay_limit":77,"search_delay_counter":0,"contact_state":0,"target_lost":1,"reaction_state":0,"current_hit_points":8,"default_attack_type":4,"interest_runtime_index":-1,"interest_scene_index":-1,"target_runtime_index":-1,"target_scene_index":-1}}
      ],
      "mission":{"id":"m000","status":"active"},
      "tags":{"source":"stable-mod-read-only-process-snapshot"}
    },
    {
      "id":"move_return_observed","sequence":5,"elapsed_ms":4754,
      "camera":{"position":[0,0],"viewport":[1024,708],"zoom":[1,1]},
      "world":{"size":[4960,2240],"tracked_actor_count":1,"source_entity_count":1630,"runtime_object_count":127},
      "actors": [
        {"actor_id":"scene:1436","role":"player","scene_index":1436,"database_entry_id":924,"display_name":"强子","faction_id":3,"position":[48,24],"target_position":[48,24],"facing_direction":8,"alive":true,"hit_points":{"current":8,"maximum":8},"native":{"goal_kind":1,"command_variant":1,"command_pending":0,"movement_active":0,"movement_path_state":0,"movement_mode":0,"resolved_goal_x":48,"resolved_goal_y":24,"path_override_active":0,"runtime_index":18,"runtime_type":1,"target_status":0,"selected_for_command":0,"search_or_return_active":0,"search_delay_limit":77,"search_delay_counter":0,"contact_state":0,"target_lost":1,"reaction_state":0,"current_hit_points":8,"default_attack_type":4,"interest_runtime_index":-1,"interest_scene_index":-1,"target_runtime_index":-1,"target_scene_index":-1}}
      ],
      "mission":{"id":"m000","status":"active"},
      "tags":{"source":"stable-mod-read-only-process-snapshot","observed_positions":[[266,136],[248,136],[234,133],[216,124],[208,117],[208,108],[208,104],[190,95],[176,88],[158,79],[144,72],[132,66],[114,57],[100,50],[82,41],[68,34],[56,28],[48,24]]}
    }
  ]
}
